{
"schema": "aurum.fake-provider-profile",
"version": 1,
"profile": "fake-provider-v1",
"lock": ".board/locks/oci/fake-provider-v1.lock.json",
"lock_digest": "sha256:9d1046ce7e8cb7c87b32eaf75198916a0aa99ed963cb45a1003f6c0033fdfce8",
"network": "none",
"user": "65534:65534",
"cap_drop": "ALL",
"cap_add": "none",
"mounts": "none",
"devices": "none",
"pull": "never",
"tmpfs": "rw,nosuid,nodev",
"checkout_readonly": true,
"read_only_rootfs": true,
"no_new_privileges": true,
"privileged": false,
"timeout_seconds": 60,
"memory_mb": 256,
"cpu_millis": 1000,
"pids_limit": 128,
"tmpfs_mb": 128,
"stdout_limit_bytes": 65536,
"stderr_limit_bytes": 65536,
"max_input_files": 10000,
"max_input_bytes": 67108864,
"module_cache": "/go/pkg/mod",
"module_cache_read_only": true,
"provider_endpoint": "http://127.0.0.1:8080/v1",
"dns": "denied",
"egress": "denied",
"api_key": "absent",
"credential_sources": "denied",
"response_scripts": "digest-pinned",
"response_scripts_root": "/tmp/aurum-fake-provider",
"request_timeout_seconds": 5,
"max_response_bytes": 65536,
"max_responses": 64,
"environment": {"GOPROXY": "off", "GOSUMDB": "off", "GONOSUMDB": "*", "GOTOOLCHAIN": "local", "OPENAI_API_KEY": "", "OPENAI_BASE_URL": "http://127.0.0.1:8080/v1", "HTTP_PROXY": "", "HTTPS_PROXY": "", "NO_PROXY": "*"},
"command": ["go", "test", "-mod=readonly", "./..."]
}
